{
  "difficulty_distribution": {
    "Easy": 1,
    "Medium": 1
  },
  "review_status_distribution": {
    "Unused": 2
  },
  "total_questions": 2,
  "usage_summary": {
    "average_usage": 12.5,
    "maximum_usage": 18,
    "minimum_usage": 7,
    "total_usage": 25,
    "tracked_questions": 2,
    "usage_distribution": {
      "7": 1,
      "18": 1
    }
  },
  "coverage": [
    {
      "label": "Explanations drafted",
      "completed": 2,
      "missing": 0,
      "total": 2,
      "coverage": 1.0
    },
    {
      "label": "Answer rationales captured",
      "completed": 2,
      "missing": 0,
      "total": 2,
      "coverage": 1.0
    },
    {
      "label": "Keywords assigned",
      "completed": 2,
      "missing": 0,
      "total": 2,
      "coverage": 1.0
    },
    {
      "label": "Reference links added",
      "completed": 2,
      "missing": 0,
      "total": 2,
      "coverage": 1.0
    },
    {
      "label": "Media attachments added",
      "completed": 1,
      "missing": 1,
      "total": 2,
      "coverage": 0.5
    },
    {
      "label": "Media alt text provided",
      "completed": 1,
      "missing": 0,
      "total": 1,
      "coverage": 1.0
    },
    {
      "label": "Usage tracking configured",
      "completed": 2,
      "missing": 0,
      "total": 2,
      "coverage": 1.0
    },
    {
      "label": "Tags applied",
      "completed": 2,
      "missing": 0,
      "total": 2,
      "coverage": 1.0
    }
  ]
}
